"id"	"author"	"deltas"	"body"
"t3_7j5asr"	"ZeusThunder369"	"7"	"A zygote/fetus is a human being --&gt; It is immoral to kill human beings --&gt; Thus an abortion is immoral1) There is plenty of reason to suggest that a zygote/fetus is not a person, but there is no reason to believe that it isn't a human being2) Even among pro-choice advocates, most probably would agree that it is immoral to kill human beingsIn order to conclude that an abortion is a morally neutral act, one most disagree with points 1 and/or 2, and I can't see any reasonable way to do that.- We refer to the zygote/fetus as \\"the child\\", \\"the baby\\", etc... Not \\"it\\" or \\"the zygote\\" or \\"the thing\\".- A pregnant woman getting injured/dying bring extra sadness or outrage from our society than a non-pregnant woman. Saving \\"the baby\\" at the expense of the mother's life, or the mother dying but giving birth, is a common story element in media (media reflects societal values).- Most people would be appalled if women were to just get abortions out of convenience a few days before they were due to give birth. Not saying this is what happens, just that most in our society wouldn't be comfortable with this.- It isn't really logical to think that a fetus has no moral value one minute, then the next minute as soon as it is born it now has as much (or even more) moral value than any other person.*Explanation of title: I don't believe that all immoral acts should automatically be illegal; It's a case by case basis. In the case of abortion, I don't think the state should be forcibly preventing people from getting abortions or imprisoning them against their will because they got an abortion.*_____; *This is a footnote from the CMV moderators. We'd like to remind you of a couple of things. Firstly, please* ***[read through our rules](http://www.reddit.com/r/changemyview/wiki/rules)***. *If you see a comment that has broken one, it is more effective to report it than downvote it. Speaking of which,* ***[downvotes don't change views](http://www.reddit.com/r/changemyview/wiki/guidelines#wiki_upvoting.2Fdownvoting)****! Any questions or concerns? Feel free to* ***[message us](http://www.reddit.com/message/compose?to=/r/changemyview)***. *Happy CMVing!*"
"t1_dr4e95n"	"akuzena"	NA	"Its not for you to decide if its moral. Pro choice means youre leaving the decision up to the woman who wants the abortion."
"t1_dr4qppr"	"Durzio"	NA	"Okay, but what if this person is a woman who is pregnant? This doesn’t address the question."
"t1_dr4rsip"	"akuzena"	NA	"If OP wants to not have an abortion then cool. The point is that the decision to either have or not have an abortion should always be available. The opinions of others dont matter in the decision of the person who is pregnant. The idea is that the choice to have an abortion must not be restricted from those who want one, and abortion shouldnt be forced on people who dont want one."
"t1_dr4rur6"	"Durzio"	NA	"I agree with you, I am also pro choice. But this question is about morality, not legality. I was simply pointing out that your original statement did not address this."
"t1_dr4t80p"	"akuzena"	NA	"Oh alritey i thought we were referring to like if abortion should be allowed or not based on morality. Personally i have no stake in this because im a male but heres my opinion anyway. Abortion is alright. If you base your morality on whether or not you cause harm to another living thing, then abortion does not make you a bad person. Souls are not real, fetuses are not alive and they are not aware therefore no pain is caused by the abortion. Furthermore morality is relative and the universe is meaningless but that opens up a whole like philosophical debate rabbit hole that keeps going on forever."
