"id"	"author"	"deltas"	"body"
"t1_ddh2imy"	"bryry"	"6"	"Sorry for the delayed reply. And thank you for the response.I've counseled hundreds of patients and a wide variety of issues. Never have I just handed them a paper without saying anything. I would feel odd and incomplete. Plus, they would inevitably have questions that need answers. I would feel a responsibility to counsel them appropriately.In fact, we have a method called - Teach Back. To ensure the patient has understood the information. They have to repeat back to the doctor the important points of the topic."
"t1_ddgzp19"	"soitcause"	"1"	"I don't think handouts would be very effective because most people aren't well versed enough in medicine to understand them. I'm not saying that people are stupid, but a doctor can explain things such that a patient is much more likely to understand both their options and the salience of those options."
"t1_ddfn2u0"	"muffinopolist"	NA	"&gt; If a physician is morally opposed to abortion then they should not be forced by the government to engage in activities they find morally objectionable. I have been directly asked by patients for specific diagnostic testing and therapies that oppose my own ethics and morals. All physicians should be free to follow their personal ethics. Can you expand upon this? Also, say if an unmarried woman were consulting you on forms of birth control, and you believed sex outside marriage to be morally objectionable, do you think it justifiable to refuse to give her the information she requested? Or mislead her? Or would you refer her to another doctor?"
"t1_ddfrjat"	"Jimmy_Smith"	NA	"Best practice would be, in my view, to refer the patient to a doctor capable of helping the patient."
"t1_ddfueo3"	"bpierce2"	NA	"Yeah but some of these people are so nuts they view that as being complicit and won't want to even do that."
"t1_ddgh44p"	"calafragilistic"	NA	"Then they open themselves up to litigation"
"t1_ddh1ofm"	"bryry"	"6"	"Thank you for the response. My replies may be a bit delayed. Basically, a physician must advocate for their patient's well-being and health; while always trying to follow Hippocrates' most famous aphorism - First do no harm.If they believe a therapy or procedure will harm someone, they cannot in good conscience advocate for that procedure. In fact, many doctors would feel an obligation to advocate that the patient not receive the procedure.; say if an unmarried woman were consulting you on forms of birth control, and you believed sex outside marriage to be morally objectionable, do you think it justifiable to refuse to give her the information she requested?The physician would need to demonstrate why they believe a person would be medically harmed. Which in this case would be highly unlikely, so - no.;or mislead her? Definitely not. Doctors should not intentionally mislead their patients. ;Or would you refer her to another doctor?Yes, and this is what typically does happen in the real world."
"t1_ddfivt8"	"peeup"	NA	"I don't think that you're really pro-abortion, or at least you shouldn't be. Here's why:I agree with you on all the points you made, and you claim (if I understand correctly) that the big difference between your view and pro-choice is that you believe that abortion is the correct option rather than just an option. For me, and I think for you too, the morality of abortions doesn't really concern the fetus because it has no agency, it isn't human, it's a parasite, etc. However, you should consider the massive psychological problems with abortion. I am not a woman, but I know a few who have had abortions and they tell me that, even years later, the operation still weighs on them heavily. Nightmares of their baby's eyes and voices. Constant guilt - survivor's guilt even. Having an abortion is unlike any other medical operation; even if you are not taking away life, you do have to live with pulling the plug on potential life. That can really mess with you. This must be weighed properly against the pragmatics of abortion.Certainly you are not pro-psychological damage. And, unfortunately, that is a necessary consequence of abortion. Therefore, I don't think its right for you or most anyone to label themselves as pro-abortion as you have defined it. Pro-choice is a label, but it is also a spectrum. You can be pro-choice and also believe that abortions are the best option, much in the same way that you can be a Republican and still want to fund something like social security."
"t1_ddf8hhw"	"moonflower"	"45"	"Is it necessary for you to regard the developing baby as a ''parasite'' and as less than human in order for you to be in favour of unlimited abortion?Could you not regard the developing baby as a human being and still hold your view on unlimited abortion?Also, you didn't say what would happen to the aborted babies after they are viable ... would you kill them, leave them to die, or try to save their lives? The problem is, if they are born very early, they will be at great risk for lifelong serious disabilities if they survive.So what do you do with all those aborted 24 week babies?"
"t1_ddfjvo1"	"ILovemycurlyhair"	NA	"Not op, but the baby would be no different of another baby. The mother would have to either take care of it or give it up for adoption. If it's urgent enough the hospital will care for the baby till the legal options are resolved."
"t1_ddfpoq8"	"moonflower"	"45"	"Don't you think there is a moral problem with aborting a perfectly normal healthy developing baby at 24 weeks and then condemning it to a life of severe disability?"
"t1_ddfwikd"	"ILovemycurlyhair"	NA	"Well take it up with nature that it doesn't grow them in perfect little incubators with no need for boy autonomy. Morally, the woman (a human being) is higher in the list than the possibility of a human being. If you find a way to have those perfect little fetuses out of the womb, then no need for a woman.Realistically no woman will put herself through 6 months of hormonal and physical changes if she doesn't plan on keeping it. It's just more realistic. However, if she chose to the take it out (not directly kill it) there is nothing wrong with it, because I've got no better alternative. I still thing her right to her body overpowers the fetus possibility of becoming a human being."
"t1_ddfx0x6"	"moonflower"	"45"	"So what would happen to the aborted babies after they are viable ... would you kill them, leave them to die, or try to save their lives?"
"t1_ddfojd0"	"Itsapocalypse"	NA	"It's fundamentally flawed to think of it as a human being. OP mentioned that fetuses are parasitic in nature, which is not the nature of living human beings. A growing ball of cells isn't a human, it's, at its very best, \\"almost human\\", which is an important distinction. Male masturbation and female menstruation are not human. Feelings are ultimately not important as a judge of humanity."
"t1_ddfpqs2"	"moonflower"	"45"	"It is a human being in development - it doesn't suddenly become a human being at some arbitrary stage of development.You're right that a single gamete is not a human being, but the life of the human being starts at conception."
"t1_ddgb1cs"	"Itsapocalypse"	NA	"X1 becoming X2 over time and conditions does not mean that X1=X2. For example, if you leave food out, mold will grow on it, making it moldy food, but food is not moldy food before mold grows on it. A gathering of cells that parasitically feeds on a host is not a living human baby. It is the foundation for something that *could eventually* be a baby given the decision to let the parasitic feeding continue. Certainly you wouldn't want a doctor telling you that you are obligated to let a tumor grow inside of you, because the cells are 'living'. No, it is a fundamental change to your body, it is something that uses your personal body nutrient sources for its own sustenance. It is your decision whether you let it continue to share your body."
"t1_ddgbhxi"	"moonflower"	"45"	"A tumour is not a human being in development - it will never develop into a person - and this has nothing to do with the law or the morality of killing it, it is an argument in its own right."
"t1_ddf4hci"	"jumpup"	"17"	"your argument seems to be its a parasite, thus should be treated as a parasite, but a woman should not be forced to remove it, only hinted uponnow the taxes issue is easy to say, but increased taxes because people don't use condoms properly isn't going to fly with most people no matter how small the increase.requiring doctors to tell them is a waste of time that's what the internet is for, simply refer them to proper reading material.when the abortion takes place doesn't bother me either, but you shouldn't underestimate the psychological damage it can do to a person, thus there need to be strict regulations for that"
"t1_ddf67t8"	"Rockmar1"	"7"	"&gt; but increased taxes because people don't use condoms properly isn't going to fly with most people no matter how small the increaseI'm well aware of that. However, I think that the people who would oppose this are just wrong. This is a policy that could have a huge positive impact on every breathing human. Just because others can't see that doesn't make it wrong.; requiring doctors to tell them is a waste of time that's what the internet is for, simply refer them to proper reading material.Some people wouldn't bother looking on the internet, it wouldn't occur to them, or they might not believe it. Being told face to face by a doctor would have a bigger impact, and I don't see much of a cost. We require doctors to keep their patients informed in other medical areas, why not this one?; you shouldn't underestimate the psychological damage it can do to a person, thus there need to be strict regulations for thatAgree with the first part, disagree with the second. It can definitely be damaging, which is why it's in the mother's best interest to think all sides through. Again, I'm not saying we should force people to have abortions. We should encourage them though, and we definitely shouldn't ban abortions with any restrictions."
"t1_ddf8wzf"	"jumpup"	"17"	"just because it can make an impact does not mean they deserve money from other people to make it, i could make an impact with a brand new suit, but i'm not expecting the goverment to pay it. they choose to have sex, they choose to do so unprotected, they should pay for the consequences, and if that means using their savings or getting a loan then its a learning experience for them.people need to do their own research, telling them that there is a site or a book (there are countless baby books) is sufficient, them not bothering to read a few pages during the 9 months time they have is shear laziness. hell i had to read more just to put together ikea furniture.no offense but mental health of the mother or attending doctors is a higher priority the killing an infant, it can always be put up for adoption, but to do it simply because its possible with disregard for other complications is reckless"
"t1_ddf67tc"	"Rockmar1"	"7"	"&gt; but increased taxes because people don't use condoms properly isn't going to fly with most people no matter how small the increaseI'm well aware of that. However, I think that the people who would oppose this are just wrong. This is a policy that could have a huge positive impact on every breathing human. Just because others can't see that doesn't make it wrong.; requiring doctors to tell them is a waste of time that's what the internet is for, simply refer them to proper reading material.Some people wouldn't bother looking on the internet, it wouldn't occur to them, or they might not believe it. Being told face to face by a doctor would have a bigger impact, and I don't see much of a cost. We require doctors to keep their patients informed in other medical areas, why not this one?; you shouldn't underestimate the psychological damage it can do to a person, thus there need to be strict regulations for thatAgree with the first part, disagree with the second. It can definitely be damaging, which is why it's in the mother's best interest to think all sides through. Again, I'm not saying we should force people to have abortions. We should encourage them though, and we definitely shouldn't ban abortions with any restrictions."
"t1_ddf7x26"	"jay520"	"27"	"Delete your duplicate posts"
"t1_ddf67tb"	"Rockmar1"	"7"	"&gt; but increased taxes because people don't use condoms properly isn't going to fly with most people no matter how small the increaseI'm well aware of that. However, I think that the people who would oppose this are just wrong. This is a policy that could have a huge positive impact on every breathing human. Just because others can't see that doesn't make it wrong.; requiring doctors to tell them is a waste of time that's what the internet is for, simply refer them to proper reading material.Some people wouldn't bother looking on the internet, it wouldn't occur to them, or they might not believe it. Being told face to face by a doctor would have a bigger impact, and I don't see much of a cost. We require doctors to keep their patients informed in other medical areas, why not this one?; you shouldn't underestimate the psychological damage it can do to a person, thus there need to be strict regulations for thatAgree with the first part, disagree with the second. It can definitely be damaging, which is why it's in the mother's best interest to think all sides through. Again, I'm not saying we should force people to have abortions. We should encourage them though, and we definitely shouldn't ban abortions with any restrictions."
"t1_ddfnbvr"	"wizardnamehere"	NA	"A fetus's life has moral value. Because people's lives have moral value.We could discuss in nuance the moral value of a fetus's life and what i mean but i'll skip. What also has to be worked out is the legal rights and status of a fetus; that is when in between a zygote and a fully functioning adult legal rights are gained.There are other moral values involved, like the ability to pursue a life in a certain way, autonomy over your body. The existence of these moral values do not cancel out the existence of any of these others.An abortion can have a positive affect on people's lives affecting things like personal autonomy and the ability to pursue a certain kind of life. Yet as above, this doesn't cancel out the moral value that a fetus has.The statement that either ALL abortions are a good thing, or that no abortion ever is a good thing is not very sophisticated. Either position taken up ignores the moral value of something, whether it's the moral value of a fetus's right to live or the moral value of a woman's autonomy and right to pursue a life.Thus you should moderate your position and consider all of the factors involved that you can."
"t1_ddftzku"	"mrill"	NA	"One of your points sounds eerily like eugenics. If we are assuming that a fetus is a human, we can't just kill people if we think it'd better society. For instance if you say we should kill mentally disabled because society would be better if we didn't have to care for them, people would look at you with horror."
"t1_ddgkhbw"	"Rockmar1"	"7"	"&gt; we can't just kill people if we think it'd better societyNo, but that's just one of several reasons I listed. If they're a leech to society, AND they're threatening a person's life AND they are going to place an enormous financial burden on people AND no one really wants that particular person around anyway least of all the person who they would be around the most, THEN it starts to sound more reasonable."
"t1_ddg9m4h"	"MercuryChaos"	"4"	"Everything you've said here makes it sound like you're pro-choice. I'm curious as to why you don't think that term fits your views."
"t1_ddfq756"	"keystorm"	"1"	"&gt; In order for this to be free, I suggest a small federal tax increase to cover the cost of government funded abortions. The tax would only need to be minimal - the average cost of an abortion is a little less than $500 (source[2] ). This is a relatively tiny amount of money to the government, so the tax increase would be minimal.The benefits however, would be huge. It is highly likely that easier abortion access would help reduce the global carbon footprint, and would also reduce crime. This isn't even going into the fact that it would help improve the lives of the potential mother and father in a very direct way if the pregnancy was unwanted. Overall, this would be a good investment for society. In addition, I mention age and citizenship status because regardless of these factors, American citizens still benefit when women get abortions.Disclaimer, I'm pro-abortion, but have grown to discover theres is an underlying implication nobody talks about (because it's a bit embarassing to use unborn life as an economic principle). Also I will grossly simplify the approach, because, well, politics.As a general rule, the right tries to slim the government. One of the implications is tax cuts, because it shouldn't need that much money, where private investment is perfectly capable to do stuff at a fair price when in competition.As a general rule, the left tries to enlarge the government. One of the implications is tax raises, because it will need more money, as private investment is not capable to keep fair prices for personal necessities.The right, which is usually anti-abortion (or pro-life as they'd put it out) has come to understand that certain state investment is needed to sustain a nation. And there is no way out from taxing people. Since direct taxes need to be avoided, they need to be more creative in how they leech money from people.One serious problem is population. More money is wasted on the older 50%, and people live longer now (or are helped to live longer, whatever your approach). So there is an actual need of young tax payers who can leverage this situation. This seems stupid and far fetched, but I assure you it is not. It is engrained in religion, and in politics. But the reasoning is always the same: we need kids so we can pay all those retirements, ensure future prosperity.You can argue the abortion numbers are fairly low in a macroeconomic scope. But if you look closer, numbers are hugely engrossed by the right winged propaganda. Would those numbers make a dent in economy? Absolutely yes, because more kids means more pregnancies, meaning more kids, meaning a \healthier\\" population pyramid. A right winged politician has wet dreams with baby booms, they are great for economy in the mid term. And what when they grow old? Well that's somebody else's problem, I'll be dead by then.\Today baby boomers are old. We desperately need new kids. Burn down those abortion clinics. Profit.\\" 1487161770 \"changemyview"
"t1_ddfnjat"	"DeltaBot"	NA	"/u/Rockmar1 (OP) has awarded at least one delta in this post.All comments that earned deltas (from OP or other users) are listed [**here**](/r/DeltaLog/comments/5sjl5a), in /r/DeltaLog.Please note that a change of view [doesn't necessarily mean a reversal](https://www.reddit.com/r/changemyview/wiki/index#wiki_what_is_a_.27view.27.3F), or that the conversation has ended.^[Delta System Explained](https://www.reddit.com/r/changemyview/wiki/deltasystem) ^| ^[Deltaboards](https://www.reddit.com/r/changemyview/wiki/deltaboards)"
"t1_ddg8chx"	"SLUnatic85"	NA	"I don't get why you say you are not pro-choice. You lose me there... but I won't dwell on that, you thought of a creative new way to start the conversation. :) well played.----------------I get a little confused at your comparison of killing the fetus to killing an enemy combatant or otherwise. If you believe a fetus is a parasite and not valued as a human life than you likely would not categorize it with these forms forms of legal taking of human life in self defense, execution as punishment, or even forms of euthanasia, right? I don;t want to put words in your mouth... but you have already explained how valuing human life is different than that of an animal or parasite so to make the comparison later seems odd. You should compare abortion more to stepping on a bug or pulling off a leech and throwing it into the garbage. Even putting my dog down might have more moral hardship than removing a parasite or mosquito, so keep the line at human v. not human for simplicity. -----------------------------But to the rest of your post... I am fairly sure that the core of pretty much every view you explain here is still 100% that you believe that a fetus (at all points from conception to live birth) is not valued as a human life by you and in fact better classified as a parasite, like a mosquito. I don't get how you are asking people to look past that, or to not get \\"hung up\\" on that fact. That ABSOLUTELY IS the conversation we are having when discussing abortion in general, and we cannot sneak past the difference in belief. To try to defend any one of your views in conversation with any person who believes otherwise about the value of the life of that fetus is going to be tough. So I guess just know that. I also personally think your parasite till birth view has some room for argument. Does the birth have to be natural or can it be cut out (c-section or other early procedures for troubled fetuses) to make it a human life? What if the fetus is born naturally or otherwise and then requires life support to remain alive due to complications? At what point in life do you suppose that a parasite/fetus/baby/child DOES start producing health benefits for the mother while depending on their food and other supporting functions and energy for survival? If someone walks up and stabs a woman in the stomach to end the life of her fetus but she lives, how do you judge that situation? If these are going to be your hard lines you should consider that a two year old will die if left completely alone or without parental type support and feeding 100% of the time. -------------------------Then you seem to claim (as your closing point, maybe coincidentally) that your view does not depend on that you think a fetus is not a human life, and a women should be able to kill it either way (I assume not just specifically if the mother's life is physically threatened by the fetus' living). I find that extremely hard to believe, given how you set up your parasite beliefs. Care to elaborate on how that might work? If you did think the fetus to be a human life (I am not sure how you can honestly sympathize with that), are you suggesting that killing a human life at 5 months living in the womb would be different than killing it at 5 months living in someone living room? Would you kill a 6-month-old child if the husband leaves and supporting the child now doesn't make financial sense, like you might for a child in the womb for 7 months? Is finding out at 1 and a half years old the the kid has downs syndrome the same a finding out at 6 months and a sound reason to terminate? Would you think it any more or less dependent on the parent for survival? Any more or less defenseless? Any more or less a risk to the mother or others (like in wartime or legally acceptable self-defense situations)? Any more or less deserving of human rights or protections as a human? I tend to think, that both morally and legally, if a fetus is considered a human life, and valued as a human life, then it would or should be protected as such, no?--------------------------------If you have read this far I may as well ask another question. lol. What are your thoughts when someone says that if population control and unwanted babies is the real issue here, what about not having sex to create more babies at all? And this is coming from a dude who loves sex so don't be afraid to bash the idea, haha. I only mean to say that honestly there is a MUCH easier solution to having all these unwanted babies or controlling population growth than deciding on when it is or isn't OK to kill them as a human life or not, and it would be to not create them in the first place, right? Food for thought...I honestly believe that the legality and practices of abortion or the regulations that surround it should be decided completely by women who have been consciously pregnant, otherwise your vote on the matter doesn't count, LOL! (I am not a women nor have I had kids yet FYI). Just a thought I have had as it is a hugely complicated topic. ----------------------I wish you the best though, there is a lot of good comments here. I really do enjoy conversations like this. I hope you learned something or achieved whatever it is you set out to achieve. :) Feel free to fire back!"
