"id"	"author"	"deltas"	"body"
"t1_ddf7o70"	"jay520"	"27"	"Firstly, your position is a pro-choice position, it's just a radicalized sort of pro-choice position. For example, atheists who happen to be extreme (e.g. anti-theists) don't stop being atheists.But I don't consider that to be very important. More important is this: the views that you have given thus far could all be given in support of letting unwanted babies die. Do you also hold this view?; Abortions help society....There are many reasons that we should try to minimize the number of unwanted babies.Everything here also applies to unwanted babies who are already born.; View: A fetus is essentially a form of parasite, and women deserve the ability to remove such a parasite from their bodies.I assume this is a sort of a bodily autonomy argument. It seems like you're saying something like: women have a right to do what they want with their own bodies. This gives them the right to remove parasites that are attached to their body. Therefore, since fetuses are parasites, women have the right to remove fetuses.A similar bodily autonomy argument can be given to support having the right to let babies die. You could say something like: all people have a right to do what they want with their own bodies. This gives them the right to refuse to care for others. Therefore, people have the right to refuse to care for fetuses (thus letting them die).; View: Abortions should be allowed up until birth, after which they should no longer be allowed.So what you're saying is *even if* the fetus could theoretically survive if the woman went through special surgical procedures, no woman should be forced to go through with this procedure. Instead, women should retain their right to an abortion, even if the baby could be saved (because the woman has a right to bodily autonomy).A similar case can be made for letting babies die. *Even if* a particular baby could theoretically survive if a particular individual went through a special procedure (i.e. by giving the baby to authorities), no individual should be forced to go through with this procedure. Instead, everyone should retain their right to let babies die, even if the baby could be saved (because people have a right to bodily autonomy). In conclusion, everyone should have the right to let babies die, even if the only thing you need to do is give the baby to the authorities. Further, we actually *should* let all unwanted babies die, because it would be good for society. Do you believe this?"
"t1_ddg7wo7"	"kodemage"	NA	"You do realize that people do have a right not to care for babies once they are born, right? No one is forced to be a parent after their child is born. In my state you can drop the child off at any number of places including Police Stations, Fire Stations, Hospitals, etc and with no questions other than the child's name and date of birth (both technically optional) you can legally leave a child there for the state to take care of."
"t1_ddf9a5y"	"Christopher_Tietjens"	"1"	"You didn't really challenge OPs view except that it is classified as pro-choice in your book."
"t1_ddf9cv6"	"jay520"	"27"	"I think you replied to the wrong person."
"t1_ddfg7yz"	"kayzingzingy"	NA	"Wow this was such a well thought out response. Kudos. This is what I like about this subreddit"
"t1_ddfbz1a"	"Rockmar1"	"7"	"&gt; the views that you have given thus far could all be given in support of letting unwanted babies die. Do you also hold this view?I don't, and here is the key difference. A baby that has been born is no longer directly dependent on its mothers nutrients for survival. They could get their nutrients from anywhere. Once the baby is born, giving it up for adoption is a valid option. To tie this in with my views specifically, imagine that tomorrow some technology was invented that allowed people to get fetuses out of themselves, put them in some sort of artificial womb, and let them continue their development there free from the mother. If/when this technology becomes available it will have a drastic effect on my views, but since it is not yet available I see abortion as the best option when you've got a fetus in you that you don't want.; You could say something like: all people have a right to do what they want with their own bodies. This gives them the right to refuse to care for others. Therefore, people have the right to refuse to care for fetuses (thus letting them die).Again, adoption is a thing. We actually DO have the right to refuse to care for a baby if we don't want it and it's already born.So what you're saying is even if the fetus could theoretically survive if the woman went through special surgical procedures, no woman should be forced to go through with this procedure. Instead, women should retain their right to an abortion, even if the baby could be saved (because the woman has a right to bodily autonomy).Yes.... almost. I would completely agree with it if you changed \\"because the woman has a right to bodily autonomy\\" to \\"because aborting unwanted fetuses is generally good for everyone\\".; Further, we actually should let all unwanted babies die, because it would be good for society.Honestly from a 100% pragmatic perspective that's probably true. But that's getting off on a tangent. Keep in mind that one of the biggest differences between a fetus and a born baby is that the born baby does not pose any threat to the mother any longer (as long as she's allowed to give it up for adoption). The same cannot be said for a fetus. If we compare abortion to this hypothetical surgery that would get the baby out, it would matter a lot how risky both options are. I don't know of any such procedure that would be less risky than an abortion. If there were such a procedure that would probably change my view, at least on late term abortions."
"t1_ddfe8eo"	"jay520"	"27"	"&gt; Once the baby is born, giving it up for adoption is a valid option. To tie this in with my views specifically, imagine that tomorrow some technology was invented that allowed people to get fetuses out of themselves, put them in some sort of artificial womb, and let them continue their development there free from the mother. If/when this technology becomes available it will have a drastic effect on my views, but since it is not yet available I see abortion as the best option when you've got a fetus in you that you don't want.This contradicts what you said earlier when you said people should have the right to late term abortions even when \\"*the fetus would be able to survive on its own if it were surgically removed from the woman in the proper manner.*\\" But now you are now saying that abortions should not be allowed when there are alternatives that keep the baby alive. So are you against late term abortions or not?; Honestly from a 100% pragmatic perspective that's probably true. But that's getting off on a tangent. Well, it's not getting off on a tangent. I'm testing your views by applying them to actual cases. Not sure how that's tangential. ; Keep in mind that one of the biggest differences between a fetus and a born baby is that the born baby does not pose any threat to the mother any longer (as long as she's allowed to give it up for adoption). The same cannot be said for a fetus. If we compare abortion to this hypothetical surgery that would get the baby out, it would matter a lot how risky both options are. I don't know of any such procedure that would be less risky than an abortion. If there were such a procedure that would probably change my view, at least on late term abortions.Well, I'm assuming the hypothetical surgery that you mention when you said \\"*...the fetus would be able to survive on its own if it were surgically removed from the woman in the proper manner. However, I believe that just because it would be able to survive on its own does not change the fact that it is still essentially a parasite and the woman still deserves the right to remove that parasite from her body...*\\" This seemed like you were saying that abortions should be allowed even if the woman has other safe alternatives to remove the baby. If you are not saying that and if I've mischaracterized you, then please ignore everything that I've said up to this point.---But let's run with this idea that abortions are acceptable *unless* there are other safe alternatives to remove the baby. That is, abortions are *not* acceptable when the fetus can be safely removed without dying (I think this is your view, yes?). Why believe this is the case? It doesn't seem to follow based on what you've said thus far. I'll try to explain why by appealing back to an analogy you used in your OP.In your OP you said \\"*If it is moral for someone to slap a mosquito sucking their blood, then it is moral to allow a woman to abort a fetus.*\\" Presumably you would also say that it's moral to kill a mosquito that's sucking your blood *even if* you have safe methods of removing the mosquito without killing it. Why not say the same about fetuses? You paint fetuses as parasites just like mosquitos. So why not also say: it's moral to abort (and thereby kill) a fetus in your body *even if* you have safe methods of removing the fetus without killing it. A parasite is a parasite (whether it's a fetus or a mosquito) and it doesn't seem morally relevant *how* I choose to remove it. You might say that the difference between the fetus and the mosquito is that the fetus is a person and the mosquito is not...but you have already admitted that you don't believe fetuses are persons (and you don't care if they are persons anyway).---**(I feel that this part of my post is actually more important than everything prior to this point. So feel free to ignore everything before this sentence if/when you respond)**EDIT: Actually hang on a second. In another post you say:; Standard pro-choice is generally focused on the ability for the woman to make a choice for herself (hence the name). Sorta like \\"people should be allowed to make choices about their own bodies -&gt; women are people -&gt; women should be allowed to make choices about their own bodies\\". My view is more focused on the (almost universal) positive aspects of abortion. More like \\"aborting unwanted babies is always a good thing for society -&gt; we should be encouraging people to make choices that benefit society &gt; therefore we should be encouraging people to abort their unwanted babies\\". Women's rights don't really factor into my view, but are a happy side effect.Why can't you say the exact same thing with regard to killing unwanted babies? Why can't you say \\" ~~aborting~~ killing unwanted babies is always a good thing for society -&gt; we should be encouraging people to make choices that benefit society &gt; therefore we should be encouraging people to ~~abort~~ kill their unwanted babies\\". How is this argument not exactly the same? Note that I'm saying *killing* babies, not \\"merely\\" letting them die.Now, you might say that the difference between killing unwanted babies and aborting unwanted fetuses is this: a fetus necessarily hinders the bodily autonomy of its \\"host\\" in a way that babies do not (i.e. you can remove the baby from your life without killing it, unlike a fetus). But, as you say in the above quote, bodily autonomy has nothing to do with your support for abortion; bodily autonomy is, as you say, \\"a happy side effect\\". You are justifying aborting unwanted fetuses by appealing *solely* to the benefits to society. So, again, how does this not support killing unwanted babies?Or, you might say that the difference between killing unwanted babies and aborting unwanted fetuses is this: babies are persons and fetuses are not, thus killing the latter is okay but not the former. But this is not what you believe. You said in your OP that \\"*I believe that abortion should be an option even if it were unequivocally proven that a fetus were equal to a human life. Essentially, this boils down to 'I don't care if a fetus is a human or not, women should be able to abort it either way'.*\\" So you think that killing unwanted fetuses would be okay *even if* fetuses were persons. So clearly you are okay with killing *persons*, so long as it benefits society. Why can't you say the exact same thing about unwanted babies? Why not say: killing unwanted babies benefits society, therefore we should kill unwanted babies - it doesn't matter that they are persons.So I don't see how your views don't also justify killing unwanted babies (not just letting them die, but *killing* them). I can think of two ways to justify abortions without justifying killing babies: by saying that fetuses hinder bodily autonomy, or by saying that fetuses aren't persons. But you have explicitly rejected the relevance of both of these. This, I feel, is the most interesting/important implication of your view. So, I would be okay if you only responded to the parts of my posts dealing with this issue (i.e. the three paragraphs right before this paragraph)."
"t1_ddfj75r"	"Ecnassianer"	NA	"&gt; Why not say: killing unwanted babies benefits society, therefore we should kill unwanted babies - it doesn't matter that they are persons.For that matter, the age of the unwanted person seems superfluous. It seems like this line of reasoning extends to justifying killing unwanted persons of any age."
"t1_ddfjojc"	"ILovemycurlyhair"	NA	"Not op babies can be taken care of by other people no need of the biological mother. Not the same with a fetus. No need for the mother to inconvenience itself with the physical and hormonal changes of accommodating another creature inside of her. All those inconveniences should be a choice not imposed. It doesn't matter if there is the possibility of something inside her. If she doesn't want it inside her she should be able to take it out."
"t1_ddfjx0q"	"Sheexthro"	"17"	"&gt;Not op babies can be taken care of by other people no need of the biological mother. Not the same with a fetus. No need for the mother to inconvenience itself with the physical and hormonal changes of accommodating another creature inside of her.In fact u/jay520 already addressed this line of reasoning, when he said;Now, you might say that the difference between killing unwanted babies and aborting unwanted fetuses is this: a fetus necessarily hinders the bodily autonomy of its \\"host\\" in a way that babies do not (i.e. you can remove the baby from your life without killing it, unlike a fetus). But, as you say in the above quote, bodily autonomy has nothing to do with your support for abortion; bodily autonomy is, as you say, \\"a happy side effect\\". You are justifying aborting unwanted fetuses by appealing solely to the benefits to society. So, again, how does this not support killing unwanted babies?Yes, **had OP said** that abortions are good only because of bodily autonomy, then he could make that argument. But actually he said that they were good, full stop."
"t1_ddfwnul"	"ILovemycurlyhair"	NA	"You're right. But still is not about killing the fetus it's about removing it from someone's body. No about killing. If you remove a baby from someone's body part it won't die. The fetus will. That's where you draw the line."
"t1_ddg2k9v"	"Sheexthro"	"17"	"Again, had OP's argument been that abortions were good because women have bodily autonomy and can remove a fetus, then that would be a line to draw. However, what OP argued was that abortions were good **because** they remove a potential carbon-emitting human from the world. Well how do you draw a line there between a fetus and a baby? It seems to apply to both just fine."
"t1_ddg70u3"	"anninnha"	NA	"Or the disabled.The elderly.The orphaned.The mentally ill.The sick.This is a dangerous line of thought. Change slightly the definition of what causes harm to society/planet, and this list would grown and include anything you want.I agree with adults who are mentally competent having the right to decide, otherwise no. Meaning: voluntary euthanasia.Besides: we know that there's people who cannot have children and would like to adopt. Why not seeing them as an option to OP views? After all, if they cannot adopt they will try surrogate mothers and in the end a baby will still be born."
"t1_ddfjwsm"	"jay520"	"27"	"These are all important considerations if you justify abortion based on bodily autonomy (which I would agree with). But the OP does not care about bodily autonomy in his argument for abortion. The only relevant consideration is the societal benefit. Therefore, it doesn't matter that unwanted babies can be taken care of by other people; they should nevertheless be killed since doing so benefits society (not my view, but this is what seems to follow given by the OP's views)."
"t1_ddfnj5w"	"Rockmar1"	"7"	"Ok, I'm going to stop quoting every part of your post because I think that it all sort of ties together, and because of that it has partially changed my view.I think that all three of your points work pretty well together. To begin with, I think that your point about the theoretical surgery that was just as safe as the abortion procedure is interesting. ; But let's run with this idea that abortions are acceptable unless their are other safe alternatives to remove the baby. That is, abortions are not acceptable when the fetus can be safely removed without dying (I think this is your view, yes?).I started thinking about it, consider a hypothetical situation where a woman does not wish to have a child. The doctor tells her that she can have the fetus removed by aborting it or by another procedure that would save its life. After the procedure, the woman would never have to see the child again because it would be taken away and given to adoptive parents before she even woke up.In this situation, I think that the most logical thing to do would be to encourage the woman to go with whichever option was safer for her, but ultimately leave the decision up to her. After all, she could also choose not to have either. I'd like to label this idea as **point 1** because it is relevant to my view being changed. The main idea is that in this situation the woman's preferences would be the only thing worth discussing (unlike a real-world scenario in which you could never have two equivalent choices - right now you've just got abortion and childbirth, both of which have very different long-term outcomes that would need to be discussed). Also, just so it's clear, by 'preferences', I mean that since the woman is having identical outcomes anyway, it's just a matter of whichever option sounds nicer to her. So in this hypothetical scenario, it is shown that the woman's personal preference should have some bearing on what we encourage her to do.But let's ignore the option of carrying the fetus to term for now because she is absolutely certain that she does not want to go through with the pregnancy. In this case, I started considering what I would feel to be the \\"right\\" choice. To me it is definitely whichever poses less risk, but then I considered the case of a tie. In this situation, it still seems to me that abortion is the right choice because of all the other benefits I have listed. To address the portion of your post I have quoted specifically, this is why I believe that abortion is still typically the better option.So this idea alone has not changed my view, but now I want to tie it in with your other points.Why can't you say the exact same thing with regard to killing unwanted babies? Why can't you say \\" aborting killing unwanted babies is always a good thing for society -&gt; we should be encouraging people to make choices that benefit society &gt; therefore we should be encouraging people to abort kill their unwanted babies\\". How is this argument not exactly the same? Note that I'm saying killing babies, not \\"merely\\" letting them die.Others have joked about it but you actually make a pretty good case for killing babies :) ......but seriously though, no I am not completely heartless. I don't think that intentionally murdering an infant is in any way acceptable, or could ever be justified (except in incredibly contrived circumstances that really have no bearing on the real world. Think trolley problem stuff).; Now, you might say that the difference between killing unwanted babies and aborting unwanted fetuses is this: a fetus necessarily hinders the bodily autonomy of its \\"host\\" in a way that babies do not (i.e. you can remove the baby from your life without killing it, unlike a fetus). But, as you say in the above quote, bodily autonomy has nothing to do with your support for abortion; bodily autonomy is, as you say, \\"a happy side effect\\". You are justifying aborting unwanted fetuses by appealing solely to the benefits to society. So, again, how does this not support killing unwanted babies?This is also a very good point. I would like to reiterate a small bit of my view first - the part regarding the reasons for me feeling that it differs from a typical pro-choice view. I referred to my view as \\"pro-abortion\\" because I felt that the woman's choice was more of a happy side effect than a main cause for my views on abortion.Now, with that in mind let's address your points. You're absolutely right that the difference between killing the baby and having the abortion is that the fetus is feeding off the mother. This though is why we should be informing all women about their options with abortion, so that they are aware of the potential risks that can come with the pregnancy. The reason I think we should do this is in the hopes that she chooses the abortion option because1. It benefits us2. If the baby is unwanted, it benefits the womanIt's a win-win situation. And the way it benefits her is that it removes what is essentially a parasite from her body (and life, keep in mind that babies are \\"financial parasites\\" in a way. Not really the same thing though). I think that doctors should encourage ALL patients to remove ALL parasites from their bodies because allowing a parasite to live off you at your expense is no way to live.So here's how I sum it all up. This point demonstrates why I feel that abortion should be encouraged. The reason is because her bodily autonomy is being hindered by the fetus, and just like any other parasite it's better to be rid of it. Now remember Point 1. This point demonstrated a case in which the woman's personal preferences would be the deciding factor in which of two options should be encouraged: abortion or a fetus-removal-surgery.To sum it all up, you've demonstrated that my way of justifying abortions without justifying baby-killing is that fetuses hinder bodily autonomy. You've also demonstrated that a woman's personal preferences about her bodily autonomy could have an effect on what doctors encourage her to do in a situation where both outcomes were equally balanced. Therefore, I suppose that I can't deny that a woman's \\"choice\\" does have a central effect on my views, and therefore my views are some form of \\"pro-choice\\". ∆However, I'll say that with the caveat that I now feel that there should still be some sort of distinction within the field of pro-choice that would accurately distinguish these sorts of views from \\"standard pro choice\\". Maybe rather than calling it pro-abortion, I should refer to it as \\"alt-pro-choice\\" or something. I'll definitely think about it some more.Also, this has been a really good/productive discussion and I'm curious, did I address all of your key points in a way that you agree with?Edit: Minor grammar changes"
"t1_ddkh6nm"	"DianeDrangles"	NA	"The thing I notice you didn't bring up is stopping pregnancies before they happen. I'm curious what your take on that situation would be. I used to be very \\"pro-life\\" until I realized that view makes no sense and takes away a lot of options that I don't think should be gone. I also have no rebuttal to the argument of \\"what about babies who will not be taken care of because of x, y or z\\". Lately I have become much more pro-choice but still pretty much against abortions as primary forms of birth control. All that being said, I didn't see a single post where you said something like, \\"I'm totally for abortions when necessary but why not allow everyone free birth control\\". You mentioned that tax payers should fund the abortions, but not that we could do anything preventative. Calling yourself pro-abortion or alt-pro-choice is interesting to me, given that there are other options. I hope I dont sound belligerent, I promise that isn't my intent. I'm just shit at understanding what the tone is gonna be. Edit: please ignore, am dumb"
"t1_ddlwk1r"	"Rockmar1"	"7"	"Look through some of my other comments, several other people have brought up other birth control options. Essentially, I'm all for them being provided for free by the government as well. I fully support easy-access birth control and sex education."
