"id"	"author"	"deltas"	"body"
"t1_ddglgxi"	"Rockmar1"	"7"	"I've sort of addressed points like this in other parts of this post, but a good short version is this.All of the reasons that I support an early term abortion still apply in the late term. The fetus is still a threat to the mother's life. The fetus is still unwanted, and still is more likely to grow up to become a criminal. Etc.The main difference here is that the fetus could survive outside of the womb. But that would require a c-section which is, by my understanding, more dangerous than abortion. So abortion is still the safest option, and therefore saving the fetus' life puts unneeded risk on the mother.And let's compare that to an old person who is no longer \\"useful\\" (though I disagree that old people aren't useful, let's just run with it for now). An old person may be a drain on society in a way, but at least there isn't much of a chance that they will grow up to be a criminal and therefore less of a drain and more of an active danger. More importantly though, old people aren't a direct risk to another person's life like the fetus is.; Surely if we are talking about allowing a woman to be rid of her parasite that far into her pregnancy, it should be to remove it the fetus still 'alive' rather than to kill it?I sort of mentioned it already but I would only agree with this if the removal procedure was safer for the woman than the abortion procedure, AND the woman wished for that to be the option, AND the woman had the option of giving up the child for adoption and never seeing it again."
"t1_ddg78qs"	"Parralyzed"	NA	"I see a contradiction in your reasoning – you claim that:1. a fetus is to be considered a complete human life2. abortion should be legal until birth, essentially allowing to kill a human being.3. Doing so is good for society as a whole, and therefore justified.So, by this logic why stop at birth? A baby that hast just been born will be detrimental to society all the same, and it's no more human than a fetus right?So your view is inconsistent."
"t1_ddfheid"	"[deleted]"	NA	"[removed]"
"t1_ddfxrds"	"n_5"	"26"	"Sorry Lemmiwinks418, your comment has been removed: ; Comment Rule 5\. \\"No low effort comments. Comments that are only jokes, links, or 'written upvotes', for example. Humor, links, and affirmations of agreement can be contained within more substantial comments.\\" [See the wiki page for more information.](http://www.reddit.com/r/changemyview/wiki/rules#wiki_rule_5)If you would like to appeal, please [message the moderators by clicking this link.](http://www.reddit.com/message/compose?to=%2Fr%2Fchangemyview&amp;subject=Rule+5+Appeal+Lemmiwinks418&amp;message=Lemmiwinks418+would+like+to+appeal+the+removal+of+[his/her+post](https://www.reddit.com/r/changemyview/comments/5shhx3/cmv_i_am_not_prolife_nor_am_i_prochoice_i_am/ddfheid/\))"
"t1_ddfl4fk"	"shimmerman"	NA	"You seem to say even if a person were pregnant. You would advocate pro-abortion stanza to them. Which is what differs from pro-choice."
"t1_ddg6l48"	"9726121530"	NA	"I would like to address this point.View: Abortions should be allowed up until birth, after which they should no longer be allowed.Why should the cutoff point be birth? I would contend that post birth abortion/infanticide/whatever term you wish to use, should be acceptable for the same reasons why a late term abortion should be acceptable. For example I think it is just as justified to end the life of a newborn with a terrible birth defect as it would be to abort the fetus (abortion would be preferable, but lets take an example of something that isn't detected). The general case also goes along with your argument of reducing human impact on the planet, and reduction in social ills. Note, I do not necessarily know the cutoff point, but I do not consider a newborn fundamentally different from a late stage fetus in this regard. And I also do not think this is ideal. The earlier the abortion, the better."
"t1_ddgj03j"	"Rockmar1"	"7"	"&gt; Why should the cutoff point be birth?Because adoption is an option after birth but not before. A c-section is another option but it is less safe than an abortion (as far as my understanding goes). We should not force women who don't want their babies to go through a more dangerous surgery just to save the fetus.I also think it simply works well as a very clear cutoff point. We have to draw the line somewhere. The only two places to draw it that aren't completely arbitrary are at the moment of conception or at birth. Drawing it at the moment of conception is harmful for all kinds of reasons, so I think that birth is the best one."
"t1_ddfojst"	"KageJittai"	"7"	"&gt; Reasoning: This one is obvious but it must be stated, I do not believe that any woman, for any reason, should EVER be forced into having an abortion. Encouraging them is fine, informing them is fine, forcing them is not.Congrats, you're pro-choice. Nothing is wrong with the discernment of education, in fact for women to make an informed choice they must be aware of their options.All the pro-choice position is, that the women is the one who has the final say. Not the government, not the church, not the doctor."
"t1_ddf59qy"	"Kwinnox"	"8"	"I hope you don't mind if I limit myself to one of your arguments, at least for the time being. ;*View*: Doctors should be required to inform pregnant women about the safety and cost of abortions, as well as the safety and cost of pregnancy (including the costs of raising the child).;*Reasoning*: More (accurate) information is never a bad thing. Requiring doctors to inform patients about both options will allow the pregnant woman to make a more informed decision on whether or not to abort. [redacted for brevity]Are you proposing that the possibility of abortion is mentioned early on in every pregnancy?"
"t1_ddf6klk"	"Rockmar1"	"7"	"I don't mind at all. And yes, that's pretty much exactly what I'm proposing. That doctors should be required to inform all of their pregnant patients about the option of abortion."
"t1_ddf831i"	"Kwinnox"	"8"	"Alright! Figured I'd make sure I understood that properly before voicing my disagreement with that. (*Having typed this out, my comment is a little more long winded than intended. The following paragraph and the closing paragraph make my point; the rest of the body is just supporting anecdotes, really*)There are countless of instances in which it's not only entirely unnecessary to inform the mother of the possibility of abortion, but straight up damaging as well. For one example, let's assume we're dealing with a woman who actually wants to have a baby. Presenting them with the information regarding an abortion not only useless, but offensive. It's not hard to imagine that information on abortion isn't going to be well-received by an expecting mother. Particular circumstances surrounding their pregnancy may make it worse, still. Suppose the woman has been trying to get pregnant for years and it finally happened for her. Informing her of the possibility of abortion is a smack in the face. It's easy to imagine the woman wanting a different doctor after that. You can tweak that example in many different ways to end up with a situation where the mentioning of abortion is useless at best, but more often than not detrimental. Now, that might well be justified by a particular end... but does the mere virtue of \\"having mentioned it\\" justify the giving of that information? I severely doubt that. Of course, there are also countless of examples where the mentioning of abortion has its merits and I'm not trying to discount that. There ought to be some discrimination, however, between cases where abortion is decidedly off the table and cases where it might be a desirable course of action. I really do believe we should leave to the tact of the medical professionals to determine when which is the case. A blanket provision of that information is going to cause unnecessary friction between a good amount of pregnant women and their doctors."
"t1_ddfpn7q"	"TheNet_"	NA	"That's ridiculous. I don't think either of us has any empirical evidence to show, so it's just my life experience vs your life experience, but I feel obliged to say that people are not nearly as delicate as your scenarios require."
"t1_ddftso9"	"Kwinnox"	"8"	"All you have to grant me is that there are situations where abortion is off the table as a choice by the mother-to-be. Some people actually want kids. Even if you reject the notion that people might take offence to a doctor's mentioning of the possibility of abortion (which as I mention elsewhere is simply a failure to put yourself in another person's shoes), you're still left with the sheer uselessness of it in some situations. Suppose, for instance, that a woman had an emotionally taxing miscarriage earlier in life. Afterwards she had the greatest difficulty getting pregnant again, but finally it worked. She goes to the doctor who, in their first ever encounter, matter-of-factly states: \\"Oh, by the way, you can always abort!\\" That'd be so far out of left field as to be abrasive. I'm not even saying many people would react this way; I'm merely calling into question the utility and desirability of providing *all* women with information that is, to some extent, useless and upsetting."
"t1_ddfk7y0"	"BendingMomentOfDoom"	NA	"I have a friend who doesn't drink alcohol because her family has a history of alcoholism. When somebody offers her a drink in a social situation, she doesn't get offended and hurt. She just politely declines and moves on with her day.If I was experiencing a long-awaited very much wanted pregnancy, I would not be offended if a health care provider informed me about the possibility of getting an abortion. I would politely decline and move on with my day."
"t1_ddfllzu"	"Kwinnox"	"8"	"Hmm... Do you really feel that the analogy you came up with is adequate? In my mind, it doesn't even come close. As for your second paragraph, is it possible that that's a failure to put yourself in another person's shoes?"
"t1_ddfryrg"	"Matapatapa"	"1"	"Irrelevant analogy."
"t1_ddfp6oi"	"Renzolol"	NA	"&gt;Are you proposing that the possibility of abortion is mentioned early on in every pregnancy?Is it not? Here in the UK when me and my wife went to our GP office and told the receptionist my wife was pregnant the 2nd thing they asked us (after \\"did you take a home pregnancy test?\\") was if she wants to keep it. This was right after the GP office did its own test to confirm the pregnancy."
"t1_ddftf6u"	"Kwinnox"	"8"	"I explain why not elsewhere. It also wasn't a rhetorical question..."
"t1_ddfqkr2"	"[deleted]"	NA	"[removed]"
"t1_ddfqsfn"	"IIIBlackhartIII"	"57"	"Sorry nbduckman, your comment has been removed:; Comment Rule 1\. \\"Direct responses to a CMV post must challenge at least one aspect of OP’s current view (however minor), unless they are asking a clarifying question. Arguments in favor of the view OP is willing to change must be restricted to replies to comments.\\" [See the wiki page for more information.](http://www.reddit.com/r/changemyview/wiki/rules#wiki_rule_1) If you would like to appeal, please [message the moderators by clicking this link.](http://www.reddit.com/message/compose?to=%2Fr%2Fchangemyview&amp;subject=Rule+1+Appeal+nbduckman&amp;message=nbduckman+would+like+to+appeal+the+removal+of+[his/her+post](https://www.reddit.com/r/changemyview/comments/5shhx3/cmv_i_am_not_prolife_nor_am_i_prochoice_i_am/ddfqkr2/\))"
"t1_ddfmxvm"	"foodown"	NA	"&gt; CMV: I am not pro-life, **nor am I pro-choice**.; View: Abortions should be allowed up until birth, after which they should no longer be allowed.; View: Women should be forced to have abortions.You are pro-choice."
"t1_ddfy5io"	"xnakeway"	NA	"Everything you said strikes as pro-choice/abortion. I reckon there's a difference between the two terms but, both are used interchangeably in colloquial use and have too subtle of differences to actually point out.I'd argue against two points you made:;A fetus is essentially a form of parasite, and women deserve the ability to remove such a parasite from their bodies.Perhaps becoming a bit philosophical, but adult citizens can very much be 'parasites' to society as well. In the case of anything having one sided benefits to something rather irrelevant (in my analogy, not towards society), then is it worthy of being killed? Are people on social security (people who are disabled/pretend to be disabled/elders out of the work force) be eligible to be killed because they're parasites to society? They don't work, they use tax payers money to live, and essentially have very little to no contribution to society like a person in the job force paying his taxes would. What difference would it make if the baby is killed inside the womb or outside the womb? It's going to die either way, and is still a parasite under your definition. I reckon a counterpart against my aforementioned sentence is that once the baby is born, (s)he is under legal protection, but you aren't properly explaining why a fetus in the womb (or baby prior to birth) should not have those same legal protections.;Essentially, this boils down to \\"I don't care if a fetus is a human or not, women should be able to abort it either way.\\"What defines a human life is very subjective. A human life is very hard to define as, like what was said in *Ghost in the Shell*, science has yet to define what life even is. Your apathy also does not contradict nor invalid the arguments going on both sides of abortion; from pro-lifers arguing it is a human life, to pro-choice/abortorters (?) saying a fetus is a mere clump of cells. In this bit you're not arguing anything, it's simply \\"I don't care\\" which your feelings, while understandable as I somewhat feel the same way, aren't an argument in the slightest."
"t1_ddfk9ni"	"aptpupil79"	NA	"You may or may not be technically correct about the fetus as a parasite, but it's a beneficial one.There are several health benefits for the mother because of pregnancy. http://www.whattoexpect.com/first-year/photo-gallery/health-benefits-of-pregnancy-and-motherhood.aspxAlso, it sounds like you are pro family planning, not necessarily getting pregnant and then aborting... That's just a silly way of going about it. What I think it's going on is you found this idea that more people is generally bad and so you want to be provocative with this pro-abortion stance. I'd argue that focusing on getting people to get on birth control and to think about the realities of unprotected sex would be a better use of money and energy than encouraging abortions.Lastly, I think it's profoundly simplistic to say that a full term fetus is simply a parasite or has no more value than a fetus at one week old."
"t1_ddfpbo4"	"bezjones"	NA	"It's interesting, your view primarily hinges on 'the good of society'. But what is society? It's just the people that are alive. You're thinking in very narrow, present terms. But what if we expand to the future when you and I are dead? If we didn't kill the babies they would be society (and their children/grandchildren, etc.). It can't logically follow that terminating someone is good for their existence. I think your title would be more appropriately titled \\"I'm pro-eugenics CMV\\" and then we could have a much more interesting philosophical conversation about the morality of eugenics."
"t1_ddf3z3w"	"poltroon_pomegranate"	"9"	"&gt;so less humans is a good thingAt what point do we need to start killing people who have already been born?;A fetus is essentially a form of parasiteEvolution essentially designed the female body for pregnancy and birth. Pregnancy is the human body functioning as designed. Being pregnant causes difficulty but it is not the same as having a parasite. I really don't understand the idea of being pro-abortion and not pro choice. There are easier ways of preventing pregnancy that are less expensive and less harmful to women than abortion."
"t1_ddf4cpk"	"Rockmar1"	"7"	"&gt; At what point do we need to start killing people who have already been born?We don't.; Evolution essentially designed the female body for pregnancy and birth. Pregnancy is the human body functioning as designed. Being pregnant causes difficulty but it is not the same as having a parasite.It is the same in every way except that in one case the parasite could potentially become a non-parasite someday. But at the moment it is aborted, it has a lot in common with parasites, and I've listed the reasons why.; There are easier ways of preventing pregnancy that are less expensive and less harmful to women than abortion.Agreed. I fully support easy/free access to birth control, sexual education, etc. However, abortion still needs to be on the table because these methods are not foolproof and abortion serves as a good backup plan."
"t1_ddg4di0"	"intergalactictiger"	NA	"The difference between a fetus and an actual parasite (such as a mosquito) is that you didn't choose for the parasite to be there. Aside from cases like rape, the woman performed actions which directly led to the fetus being inside of her. My mother specifically intended to conceive me, therefore, I was not a parasite as a fetus. Another factor you are neglecting in your parasite analogy is emotional and mental benefit. While the fetus may provide nothing physically beneficial for the mother, the simple act of existing provides a lot of woman with emotional and mental fulfilment."
"t1_ddgjynp"	"Rockmar1"	"7"	"&gt; The difference between a fetus and an actual parasite (such as a mosquito) is that you didn't choose for the parasite to be there. Aside from cases like rape, the woman performed actions which directly led to the fetus being inside of her.You can still get pregnant even if you use a condom or are on the pill. Yeah, she could have just never had sex. And if you didn't want to get bit by a mosquito you could just never go outside. Going outside though is an action which could directly lead to a mosquito bite. But if someone slaps a mosquito are you going to tell them \Don't slap it, that's a life! Instead you should have stayed indoors for your whole life.\\" 1486335296 \"changemyview"
"t1_ddf4n5m"	"oiduts"	NA	"I submit to you that your distinction between \\"pro-choice\\" and \\"pro-abortion\\" weakens here, because it was based on your argument that abortion is good for society, where here you say that contraception and education are even more beneficial when possible. This seems to bring your position closer to pro-choice."
"t1_ddf5wm8"	"Rockmar1"	"7"	"I don't think that contraception/education are more beneficial, I think they are equally beneficial. To me it doesn't matter how you stop a childbirth. There's no moral difference between pulling out, wearing a condom, aborting the fetus, or taking the pill. The only advantage that contraception has is that it is generally cheaper. That's why I believe that all birth control whether it's condoms or abortion should be funded by the government, and paid for by taxpayers.I consider myself to be pro-abortion because abortion is the most \\"powerful\\" form of birth control (i.e. it's the one you go to when the others fail)."
"t1_ddfidxj"	"on_my_lunch_break"	"7"	"&gt; I don't think that contraception/education are more beneficial, I think they are equally beneficial. To me it doesn't matter how you stop a childbirth. There's no moral difference between pulling out, wearing a condom, aborting the fetus, or taking the pill. The only advantage that contraception has is that it is generally cheaper. So, you don't think that it matters that abortion is physically harmful to the woman? That doesn't enter into the equation for you?"
"t1_ddf6qya"	"oiduts"	NA	"Contraception is substantially cheaper and less risky, so it seems like contraception should be preferred to abortion where possible. I basically agree with you; I am one of those people who is pro-choice but anti-abortion, and it is for the above reason. I fully support abortion as a backup option but do not believe it should be the primary recourse because there are much better ones available."
"t1_ddf750i"	"Rockmar1"	"7"	"I still pretty much agree, but this is sort of getting off topic. Contraception only tangentially fits into this topic. Just because there are preferable alternatives to abortion doesn't mean someone is anti-abortion. Contraception is the much less controversial topic, so I'm focusing on abortion because I feel like most reasonable people basically already agree that contraception is ok and generally easier on the body/mind than abortion is."
"t1_ddf7nf6"	"oiduts"	NA	"The reason I bring it up is that it's hard for me to see where you differ from standard pro-choice if you support contraception ideally and abortion otherwise. You just seem pro-choice, pro-population-reduction, and pro-self-determination. The first issue seems unrelated to the latter two issues. If you believe any abortion is by nature amoral (pro-life) then the latter two aren't relevant."
"t1_ddfbywh"	"Rockmar1"	"7"	"&gt; where you differ from standard pro-choiceHere are the places where I feel I differ from \\"standard pro-choice\\". Keep in mind that my definition may differ slightly from yours as to what \\"standard pro-choice\\" is, but I'll try to focus on what I most commonly see.1. Standard pro-choice is generally focused on the ability for the woman to make a choice for herself (hence the name). Sorta like \\"people should be allowed to make choices about their own bodies -&gt; women are people -&gt; women should be allowed to make choices about their own bodies\\". My view is more focused on the (almost universal) positive aspects of abortion. More like \\"aborting unwanted babies is always a good thing for society -&gt; we should be encouraging people to make choices that benefit society &gt; therefore we should be encouraging people to abort their unwanted babies\\". Women's rights don't really factor into my view, but are a happy side effect.2. Most pro-choice people are uncomfortable with the idea of late-term abortions. I have no problem with late-term abortions, and in fact I think they should be encouraged (if it comes to it, early term abortions are better, but late term is still better than childbirth).3. As far as I know, \\"standard pro-choice\\" does not support government funded abortions or mandatory doctor information about abortions. Essentially, I think that abortions should be incentived by the government as opposed to childbirth. Standard pro choice usually views abortions as a \\"necessary evil\\"; something that should NOT be encouraged but should still be an option.4. Terminology. I haven't mentioned this one yet because it's quite different from the others, but I simply think that the term \\"pro-choice\\" is stupid. You can be pro-gun without thinking that gun ownership should be mandatory. You can be pro-marijuana without thinking that everyone should be required to smoke weed. These are also things where you think that people should have the \\"choice\\" to either partake or not. So it could be argued that all of these positions should be called \\"pro-choice\\". I think that by calling my position \\"pro-abortion\\", it draws attention to the real issue."
"t1_ddfiey1"	"on_my_lunch_break"	"7"	"&gt; (if it comes to it, early term abortions are better, but late term is still better than childbirth).If abortion is no better than birth control (in your view), then on what basis is an early abortion better than a late one?"
"t1_ddfcicg"	"oiduts"	NA	"What I propose is this mental model: Pro-Life ... Pro-Choice - Pro-Abortion - Anti-Abortion ...I agree with much of what you said, including #4. All I assert is that for the purposes of the current political conversation, your view does seem to fall under the umbrella of pro-choice, because that particular conversation is rooted in the morality of abortion rather than the societal pros and cons."
"t1_ddf4tkp"	"poltroon_pomegranate"	"9"	"&gt;We don'tSo any amount of environmental damage is worth a single human life?;It is the same in every way except that in one case the parasite could potentially become a non-parasite someday. But at the moment it is aborted, it has a lot in common with parasites, and I've listed the reasons why.This is biologically inaccurate. The relationship between a fetus and a pregnant women is more complicated than parasite and host.;However, abortion still needs to be on the table because these methods are not foolproof and abortion serves as a good backup plan.It can be an option but it is not one people want to take. Abortion is not a pleasant experience (especially if you are talking about abortion at 9 months), so it is weird to be \\"pro-Abortion\\"."
"t1_ddf5o4l"	"Rockmar1"	"7"	"&gt; So any amount of environmental damage is worth a single human life?That isn't what I said, what I said was that an unwanted child is detrimental to society, and the environmental impact is just one of the reasons why.; The relationship between a fetus and a pregnant women is more complicated than parasite and host.If this is the case, then please explain why.; Abortion is not a pleasant experience (especially if you are talking about abortion at 9 months), so it is weird to be \\"pro-Abortion\\".I could argue that childbirth is an unpleasant experience after 9 months, so it would be weird to be pro-childbirth (a.k.a. pro life). It doesn't have to be pleasant to be more pleasant than the alternative."
"t1_ddfqt6w"	"soswinglifeaway"	NA	"You realize that a woman still essentially has to go through child birth if she aborts a 9 month fetus? The only difference is she would be delivering a dead baby instead of a live one, but the process to remove a fetus that is that far along in development is pretty much the same as childbirth"
