"id"	"author"	"deltas"	"body"
"t3_5shhx3"	"Rockmar1"	"7"	"I'm making this CMV because I've noticed that my views on abortion don't really line up with either of the two main viewpoints on it (although they're much closer to a pro-choice viewpoint than a pro-life one). This isn't so much one specific view as it is a collection of related views regarding abortion.I'll specifically list the things that I believe and the things that I don't believe. I think it's good to address both sides because we live in a world where a simple sentence like \\"I support gun rights\\" has people immediately jumping to conclusions about your views on everything from race relations and gay marriage to economic standpoints and foreign policy. Addressing both sides helps to avoid people reaching incorrect conclusions.Important note: For the purposes of this discussion I am writing this with the assumption in mind that a fetus at any point in development is equivalent to a human life. I **do not** believe this and I will explain my reasons for making this assumption in the \\"Things I don't believe\\" section.Also, I am from the U.S.A. and I will be writing this with specific regards to the United States. When I say 'government', 'society', etc. I mean the U.S. government or U.S. society.**Things that I believe***View*: Abortions help society.*Reasoning*: There are many reasons that we should try to minimize the number of unwanted babies. For starters, every human who is born takes up a lot of resources, and produces a lot of pollution. The average American is responsible for roughly 20 tons of carbon dioxide emissions per year ([source](https://www.theguardian.com/environment/datablog/2009/sep/02/carbon-emissions-per-person-capita)). Essentially, humans are bad for the environment so less humans is a good thing if we consider climate change to be important.Additionally, unwanted babies are more likely to grow up in bad situations (since they were unwanted), and are more likely to become criminals detrimental to society, or if not criminals then people on welfare which is also detrimental to society. Now yes, it is possible that some aborted baby would have grown up to be the next Einstein. But since it is more likely that they will end up being detrimental to society, I see no reason why we should assume that the less likely of two outcomes will happen.-----------------------------------------------------------------------------*View*: Women of any age, citizenship status, etc. should be able to get an abortion from any abortion clinic for free, no questions asked.*Reasoning*: In order for this to be free, I suggest a small federal tax increase to cover the cost of government funded abortions. The tax would only need to be minimal - the average cost of an abortion is a little less than $500 ([source](https://clearhealthcosts.com/blog/2014/06/much-abortion-cost-draft-theresas/)). This is a relatively tiny amount of money to the government, so the tax increase would be minimal.The benefits however, would be huge. It is highly likely that easier abortion access would help reduce the global carbon footprint, and would also reduce crime. This isn't even going into the fact that it would help improve the lives of the potential mother and father in a very direct way if the pregnancy was unwanted. Overall, this would be a good investment for society. In addition, I mention age and citizenship status because regardless of these factors, American citizens still benefit when women get abortions.--------------------------------------------------------------------------*View*: Doctors should be required to inform pregnant women about the safety and cost of abortions, as well as the safety and cost of pregnancy (including the costs of raising the child).*Reasoning*: More (accurate) information is never a bad thing. Requiring doctors to inform patients about both options will allow the pregnant woman to make a more informed decision on whether or not to abort. If you oppose a doctor simply informing their patient of the facts, then you oppose spreading knowledge and have no place in any sort of philosophical discussion. If you still do not like the fact that the woman may be more likely to choose abortion when they are more aware of the facts, then maybe you should rethink your position on the matter because when people gain knowledge on the subject they become more likely to disagree with you.--------------------------------------------------------------------------*View*: A fetus is essentially a form of parasite, and women deserve the ability to remove such a parasite from their bodies.*Reasoning*: A fetus is similar to parasite for several reasons. During pregnancy, the fetus feeds off the nutrients of the mother, while providing virtually no health benefits in return. Additionally, pregnancy can result in complications that lead to the death or disability of the mother. This is analogous to a parasite such a a mosquito which feeds off another being's nutrients, provides no benefit to the host, and can result in serious harm to the host. If it is moral for someone to slap a mosquito sucking their blood, then it is moral to allow a woman to abort a fetus.Also not that this is fundamentally different from things such as breastfeeding or a mother simply providing food for her child. Breast milk serves no purpose to the mother, and the nutrients stored in food do not belong to anyone until they consume that food. In this way, a fetus in the womb truly does steal nutrients from the mother. A baby does not steal nutrients from the mother, but rather uses nutrients that were either useless to the mother (breastmilk), or provided by the mother as a gift and therefore never the mother's in the first place.----------------------------------------------------------------------------*View*: Abortions should be allowed up until birth, after which they should no longer be allowed.*Reasoning*: This point will probably cause the most controversy. Many people will disagree with this because late in the pregnancy, the fetus would be able to survive on its own if it were surgically removed from the woman in the proper manner. However, I believe that just because it would be able to survive on its own does not change the fact that it is still essentially a parasite and the woman still deserves the right to remove that parasite from her body. The fetus, while in the womb, is still feeding off the nutrients of the mother (regardless of whether or not it could survive outside the womb), and therere should be treated as a parasite.--------------------------------------------------------------------------------**Things that I do not believe***View*: Women should be forced to have abortions.*Reasoning*: This one is obvious but it must be stated, I do not believe that any woman, for any reason, should EVER be forced into having an abortion. Encouraging them is fine, informing them is fine, forcing them is not.--------------------------------------*View*: A fetus's life is equivalent to a human life*Reasoning*: As I mentioned earlier, I want this discussion to be had with the assumption in mind that fetus's are equivalent to human lives. However, I do not believe this is true. The reason I wish for this to be the assumption is that pro-lifers tend to get hung up on this which I know will lead to a meaningless discussion because I believe that abortion should be an option even if it were **uneqivocally proven** that a fetus were equal to a human life. Essentially, this boils down to \\"I don't care if a fetus is a human or not, women should be able to abort it either way.\\"----------------------------------*View*: All killing is bad*Reasoning*: There are many forms of killing that are generally considered acceptable. Soldiers kill other soldiers in wartime, people are allowed to kill in self-defense, and criminals are executed due to their crimes. All of these are perfectly legal forms of killing, and though some are controversial most would agree that at least one of the three is justified. I believe that abortion is another one of these types of killing. This is also why I don't care whether the fetus is a human or not - I view it as a legally and morally justified form of killing.While I am interested in having my view changed, I am also interested in simply having a discussion on the topic. Let's talk about abortion!_____; *This is a footnote from the CMV moderators. We'd like to remind you of a couple of things. Firstly, please* ***[read through our rules](http://www.reddit.com/r/changemyview/wiki/rules)***. *If you see a comment that has broken one, it is more effective to report it than downvote it. Speaking of which,* ***[downvotes don't change views](http://www.reddit.com/r/changemyview/wiki/guidelines#wiki_upvoting.2Fdownvoting)****! Any questions or concerns? Feel free to* ***[message us](http://www.reddit.com/message/compose?to=/r/changemyview)***. *Happy CMVing!*"
"t1_ddf3l2x"	"phcullen"	"31"	"Your argument seems to be about u wanted babies, therefore you believe people that are pregnant and don't want a child should have the ability to choose not to. Pro choice. When I think pro abortion policy I imagine more of a default to abortion and having permitted births. At most this view is \i think abortion is a better choice than adoption\\" 1488313648 \"changemyview"
"t1_ddf47dk"	"Rockmar1"	"7"	"The pro-choice viewpoint centers around the ability for a woman to make a choice (hence the name). They often say things like \\"No one thinks abortion is a good thing, but a woman's right to make choices about her body is more important\\". But I do think that abortion is a good thing (hence me calling it pro-abortion). I think that the fact that it will allow women to make their own choices is a happy side effect, but it is not the core reason that I support easy abortion access.As far as abortion being the default, that's exactly what I do believe should be true. Unfortunately, I don't see any way of doing this without forcing abortions or somehow making humans sterile, which is completely unethical. If there were a good way of doing it I would support that. And when I say default, I mean that social norm should be \\"I am pregnant so I will get an abortion, but I suppose I should consider the alternative of pregnancy\\" rather than \\"I am pregnant, but I suppose I should consider the abortion option\\". That's also why I think doctors should be required to inform patients about it."
"t1_ddg4hci"	"I_am_Bob"	"1"	"&gt;But I do think that abortion is a good thing..But your argument is basically against unwanted pregnancy, which could be accomplished much more easily, cost effectively, and safely through a liberal sex education program and easy access to cheap/free birth control."
"t1_ddgjsy9"	"Rockmar1"	"7"	"And I fully support sex education and easy birth control access. But even if there were free condoms delivered to your door daily and sex ed was taught liberally throughout a person's education, accidents are still going to happen. Abortion is, at that point, the only good solution that we currently have."
"t1_ddfi5i6"	"on_my_lunch_break"	"7"	"&gt; They often say things like \\"No one thinks abortion is a good thing, but a woman's right to make choices about her body is more important\\". But I do think that abortion is a good thing (hence me calling it pro-abortion). I don't want to have a child. If I became pregnant, I would almost certainly choose to have an abortion.Is it better for me to have an abortion, or is it better for me to avoid unwanted pregnancy altogether? The abortion is *obviously* less preferable to most people, because having an abortion is expensive, sometimes medically risky, and typically physically painful. There is also an emotional aspect to having an abortion; even if you know you're making a morally and logically sound choice, it can still be painful to decide to end a life that is growing inside you.If you believe that abortion should be a *choice* (that we shouldn't force it on anyone), and you agree with most pro-choice folks that it's preferable to prevent unplanned pregnancies rather than terminate them, then... I don't think you can call abortions a \\"good thing.\\" At the very least, you're going to need to clarify how you're using the phrase \\"good thing,\\" because you're not using it the way I understand it.Basically: If abortions are really a \\"good thing,\\" shouldn't we be getting women pregnant just so they can have abortions?"
"t1_ddfl60x"	"phcullen"	"31"	"Unless you are looking at forcing abortions I really wouldn't place you as mirror to pro-life You are pro choice and you have an opinion on weather or not people should go to term. The pro life pro choice debate is about legality of abortions not population control"
"t1_ddfnfj1"	"SueZbell"	"1"	"Forced abortion ... forced ANY action that is one of the most personal and consequential decisions anyone can make is NOT good for human society. Forcing anyone that wants to die to live is NOT good for human society. Requiring a person that wants to die to have to die slowly is torture. Forcing a newborn infant -- such as one very deformed brain/mentally and/or physically -- to suffer while it starves to death is torture. Torture is not good for humanity as a species ... it tends to feed sadistic behavior in general which is not good for society. Arguably sociopaths are created by the way they are treated. Human society is not improved by the creation of more sociopaths. Death with dignity should be permitted, including physician assisted death."
"t1_ddf5kzi"	"Galentines_day"	"3"	"&gt; The pro-choice viewpoint centers around the ability for a woman to make a choice (hence the name). They often say things like \\"No one thinks abortion is a good thing, but a woman's right to make choices about her body is more important\\". But I do think that abortion is a good thing (hence me calling it pro-abortion). Yeah, no, that's still just being pro-choice. *Some* pro-choice people say \\"nobody thinks abortion is a good thing,\\" but others don't. The *only* singular unifying ideology behind the \\"pro-choice\\" label is that abortions should be legal and accessible to women who chose to obtain them. If you believe that, then no matter what else you believe (as long as it isn't contradictory to that) doesn't matter in terms of whether you are \\"pro-choice\\" or not."
"t1_ddf6hrv"	"Rockmar1"	"7"	"If that's the case then we need better terminology. I'm sick of only having two choices on anything political, there are more than two positions on every matter.My view is that we should be encouraging abortions as much as possible. This is not what the pro-choice movement is about. Their movement is about giving women rights.Just because I support gun rights doesn't mean I'm republican. Just because I support abortion rights doesn't mean I'm pro choice."
"t1_ddf7azs"	"BrotherNuclearOption"	"1"	"I think part of the issue here is that your position is mostly outside of the current debate, almost to the point of being a non-sequitur.Whether or not abortions should be encouraged is an interesting discussion but almost entirely irrelevant at the current point in time. It would be a little like arguing about institutionalized racism back when outright slavery was still legal; that it would be a very valid line of argument doesn't make it any less irrelevant until the greater question is settled.I would argue that your position isn't so much a distinct one in the pro-choice/pro-life debate, but rather your personal reasons for being pro-choice. Furthermore, bringing the idea that we should be outright *encouraging* abortions into the current debate would do little but alienate many on the fence and provide ammo to the pro-life movement."
"t1_ddfbz4k"	"Rockmar1"	"7"	"&gt; It would be a little like arguing about institutionalized racism back when outright slavery was still legal; that it would be a very valid line of argument doesn't make it any less irrelevant until the greater question is settled.I see your point, but there's a huge difference here. Abortion is, as of today, legal in all 50 states in America. I sort of feel like we've worked that one out, at least in the same sort of sense that we've worked out slavery. Yes, there are still many people who do not support abortion, but there are also still people who think blacks should be enslaved.I guess what I'm asking is, when exactly should we talk about this?"
"t1_ddft72g"	"mathemagicat"	"2"	"&gt; I see your point, but there's a huge difference here. Abortion is, as of today, legal in all 50 states in America. I sort of feel like we've worked that one out, at least in the same sort of sense that we've worked out slavery.We haven't, though. States can't outright ban abortion, but the pro-lifers have a new strategy: they're doing an end-run around Roe v. Wade by using state regulatory authority to force abortion clinics to close. Huge numbers of Americans have essentially no access to legal abortion.[This article](https://www.washingtonpost.com/opinions/laws-courts-shrinking-access-to-abortion/2014/10/10/efd0aef4-4f25-11e4-aa5e-7153e466a02d_story.html) is from 2014; it's gotten worse since then."
"t1_ddgkvp7"	"Rockmar1"	"7"	"I really do think it's a shame that abortion access is difficult for some women. Abortion clinics should be easily accessible. I guess then that I feel that the stuff I'm talking about kinda goes along with the current battle. It's like - OK, we've gotten it legalized. Now how do we distribute it to the people?; Huge numbers of Americans have essentially no access to legal abortion.And that needs to change. The silver lining I think though is that at the very least, a 1000 mile drive to an abortion clinic is still better than no options at all. But we need to do better."
"t1_ddfcllh"	"BrotherNuclearOption"	"1"	"Granted, the gap is somewhat closer but the abortion debate is far from over, especially in the USA. Pro-life and -choice both sit just [a little under 50% according to Gallup](http://www.gallup.com/poll/1576/abortion.aspx). You also have a very strong moral minority pushing to defund organizations providing abortions (no matter what else they happen to do) and generally reduce access wherever possible. And then there are the vacant and soon to be vacant Supreme Court seats, which could have a pretty major influence on whether it remains legal.I think there is a limit to how rapidly you can force change down society's throat. I don't know when the right time would be other than it probably isn't while nearly half the population still opposes the very idea of normalized abortion."
"t1_ddfnmef"	"SueZbell"	"1"	"We should certainly support more birth control and make abortion easier. Arguably, nothing affects a woman's mental health more than issues involving reproduction. A pure pro abortion view has the potential to be oppressive -- nothing less than tyranny. China, after many years with its one child policy, requiring subsequent pregnancies to be prevented or aborted, has recently determined that millions of pregnancies -- mostly female births -- went unreported. Reproduction is one of life's stronger instincts, including in humans. A far better policy would be to teach children the truth about sex and reproduction and over population and problems associated with adding certain traits -- mental and physical defects -- to the gene pool and try to guide future generations toward a more practical choice -- each person be a parent to no more than two children, with the objective of each couple only reproducing themselves between their own life/death -- and not increasing the population beyond that."
"t1_ddfwerh"	"umkvec"	NA	"You're pro choice because you do not want to be *forced* to either have an abortion or not. That's the only real distinguishing factor between pro life and pro choice. Everything else is majority opinion."
"t1_ddfibax"	"on_my_lunch_break"	"7"	"&gt; Just because I support gun rights doesn't mean I'm republican. Just because I support abortion rights doesn't mean I'm pro choice.Those two statements aren't similar in any way. The first sentence talks about a view typical of a group; the second denies that a phrase means what it actually means. If you support abortion rights, but you don't think we should *force* anyone to have an abortion, then *you are pro-choice.* That's what that phrase means."
"t1_ddfgffa"	"waldrop02"	"1"	"&gt; I'm sick of only having two choices on anything political, there are more than two positions on every matter.On many issues, there isn't, though. On the issue of \\"do you support a woman's right to choose who uses her body,\\" there is either \\"yes\\" - pro-choice - and \\"no\\" - pro-life. There are nuances within those two positions and there are different reasons for people to make those choices, but at the core of it, that is what the abortion debate is about."
"t1_ddfenkj"	"downd00t"	NA	"&gt; then we need better terminologythat can be said about most any political topic. groups shape phrasing to be in their best interest and try to get a shitty term to stick for the opposition. hell thats why fascism just means 'any group I dont like' now"
"t1_ddfh3vi"	"chris6030"	NA	"Yes, there are more positions, inside the main 2 views. We can't make new terminology for every single viewpoint."
"t1_ddftuwd"	"Theonetrue"	NA	"Why would supporting anything make you anything? To simplify it:Supporting a topic can make you side with a party but it does not need to. Europeans are not Republican if they are pro gun laws."
"t1_ddgkl5b"	"Rockmar1"	"7"	"My point is that I feel my views differ enough from the \\"standard pro choice\\" to have a different label. There's overlap for sure but there always will be. There's overlap between republicans and democrats but it's still good to have a distinction."
"t1_ddf6kta"	"Rockmar1"	"7"	"If that's the case then we need better terminology. I'm sick of only having two choices on anything political, there are more than two positions on every matter.My view is that we should be encouraging abortions as much as possible. This is not what the pro-choice movement is about. Their movement is about giving women rights.Just because I support gun rights doesn't mean I'm republican. Just because I support abortion rights doesn't mean I'm pro choice."
"t1_ddfickx"	"on_my_lunch_break"	"7"	"&gt; My view is that we should be encouraging abortions as much as possible. This is not what the pro-choice movement is about. Their movement is about giving women rights.So you *do* think we should force women to have abortions? Or should they be allowed to choose for themselves?"
"t1_ddfmxw7"	"dragonstorm27"	NA	"I read what OP said as he thinks women should be allowed to choose for themselves, but those that are not in a position financially or emotionally to support a baby should be encouraged as those babies will become a detriment to society, both in their carbon footprint and their statistical chance of becoming a criminal if raised in an unsuitable environment."
"t1_ddfn267"	"on_my_lunch_break"	"7"	"Well, if they'll be allowed to choose for themselves, it sounds like OP is in favor of choice. And in that case, I don't understand how he can reject the label \pro-choice.\\" 1487498664 \"changemyview"
"t1_ddfn544"	"dragonstorm27"	NA	"Ehh, OP is in favor of abortion in what some would consider extreme cases, i.e., abortion all the way until birth, abortion should be encouraged to everyone regardless of situation... they're an extreme variant of pro-choice that is tipping quite heavily towards pro-abortion (all abortion) but isn't quite there yet."
"t1_ddfn8zp"	"on_my_lunch_break"	"7"	"Unless you want to mandate abortion and/or encourage women to get pregnant just so they can abort, you're not \\"pro-abortion,\\" you're pro-choice."
"t1_ddfn8zr"	"on_my_lunch_break"	"7"	"Unless you want to mandate abortion and/or encourage women to get pregnant just so they can abort, you're not \\"pro-abortion,\\" you're pro-choice."
"t1_ddg1pmj"	"[deleted]"	NA	"[removed]"
"t1_ddga7ny"	"etquod"	"42"	"Sorry Use0nceDestroy, your comment has been removed: ; Comment Rule 5\. \\"No low effort comments. Comments that are only jokes, links, or 'written upvotes', for example. Humor, links, and affirmations of agreement can be contained within more substantial comments.\\" [See the wiki page for more information.](http://www.reddit.com/r/changemyview/wiki/rules#wiki_rule_5)If you would like to appeal, please [message the moderators by clicking this link.](http://www.reddit.com/message/compose?to=%2Fr%2Fchangemyview&amp;subject=Rule+5+Appeal+Use0nceDestroy&amp;message=Use0nceDestroy+would+like+to+appeal+the+removal+of+[his/her+post](https://www.reddit.com/r/changemyview/comments/5shhx3/cmv_i_am_not_prolife_nor_am_i_prochoice_i_am/ddg1pmj/\))"
"t1_ddfra56"	"[deleted]"	NA	"[removed]"
